{
  "version": 1,
  "id": "B10",
  "review_status": "accepted_for_export",
  "review_notes": "Full independent low bronze lock-box master and20 poses viewed. Giant keyhole/arched shackle, four shortfeet, purple cords and exactly one shorthammer intact. Attack right-latch hammer drop and special diagonal/opposite-body-lean drop read separately. Complete true components, manual weight-bearing foot anchors, shared fixed body calibration.",
  "prompts": [
    "source/actions-v1-prompt.txt",
    "source/master-v1-prompt.txt"
  ],
  "canvas": {
    "size": [
      512,
      512
    ],
    "anchor": [
      256,
      450
    ],
    "body_height_px": 216
  },
  "sources": {
    "actions": {
      "path": "source/actions-v1.png",
      "size": [
        1254,
        1254
      ],
      "sha256": "962af95af7867d577673108ce2aa686609ac94e260bf0255aaf2e6ba813b472c",
      "standing_body_height": 187
    }
  },
  "portrait": {
    "path": "source/master-v1.png",
    "size": [
      1536,
      1024
    ],
    "sha256": "d2bfa3b97446294d68122e7aa0aaf58d59db585161b750ed3a6be84a1ed6badf"
  },
  "poses": [
    {
      "id": "p01",
      "source": "actions",
      "anchor_source": [
        160,
        243
      ],
      "components": [
        {
          "bbox": [
            34,
            56,
            303,
            243
          ],
          "area": 28480
        }
      ]
    },
    {
      "id": "p02",
      "source": "actions",
      "anchor_source": [
        476,
        243
      ],
      "components": [
        {
          "bbox": [
            350,
            56,
            606,
            243
          ],
          "area": 28406
        }
      ]
    },
    {
      "id": "p03",
      "source": "actions",
      "anchor_source": [
        790,
        244
      ],
      "components": [
        {
          "bbox": [
            662,
            56,
            921,
            244
          ],
          "area": 28583
        }
      ]
    },
    {
      "id": "p04",
      "source": "actions",
      "anchor_source": [
        1100,
        243
      ],
      "components": [
        {
          "bbox": [
            969,
            56,
            1230,
            243
          ],
          "area": 28496
        }
      ]
    },
    {
      "id": "p05",
      "source": "actions",
      "anchor_source": [
        165,
        481
      ],
      "components": [
        {
          "bbox": [
            30,
            287,
            321,
            481
          ],
          "area": 30757
        }
      ]
    },
    {
      "id": "p06",
      "source": "actions",
      "anchor_source": [
        480,
        481
      ],
      "components": [
        {
          "bbox": [
            354,
            292,
            624,
            481
          ],
          "area": 28413
        }
      ]
    },
    {
      "id": "p07",
      "source": "actions",
      "anchor_source": [
        796,
        485
      ],
      "components": [
        {
          "bbox": [
            682,
            294,
            942,
            485
          ],
          "area": 27917
        }
      ]
    },
    {
      "id": "p08",
      "source": "actions",
      "anchor_source": [
        1104,
        481
      ],
      "components": [
        {
          "bbox": [
            963,
            290,
            1238,
            481
          ],
          "area": 28701
        }
      ]
    },
    {
      "id": "p09",
      "source": "actions",
      "anchor_source": [
        164,
        727
      ],
      "components": [
        {
          "bbox": [
            29,
            543,
            314,
            727
          ],
          "area": 29367
        }
      ]
    },
    {
      "id": "p10",
      "source": "actions",
      "anchor_source": [
        476,
        729
      ],
      "components": [
        {
          "bbox": [
            362,
            502,
            589,
            729
          ],
          "area": 29008
        }
      ]
    },
    {
      "id": "p11",
      "source": "actions",
      "anchor_source": [
        777,
        732
      ],
      "components": [
        {
          "bbox": [
            632,
            549,
            932,
            732
          ],
          "area": 30594
        }
      ]
    },
    {
      "id": "p12",
      "source": "actions",
      "anchor_source": [
        1100,
        736
      ],
      "components": [
        {
          "bbox": [
            971,
            560,
            1237,
            736
          ],
          "area": 27093
        }
      ]
    },
    {
      "id": "p13",
      "source": "actions",
      "anchor_source": [
        175,
        981
      ],
      "components": [
        {
          "bbox": [
            29,
            801,
            304,
            981
          ],
          "area": 28517
        }
      ]
    },
    {
      "id": "p14",
      "source": "actions",
      "anchor_source": [
        483,
        985
      ],
      "components": [
        {
          "bbox": [
            361,
            768,
            595,
            985
          ],
          "area": 28414
        }
      ]
    },
    {
      "id": "p15",
      "source": "actions",
      "anchor_source": [
        791,
        987
      ],
      "components": [
        {
          "bbox": [
            651,
            812,
            980,
            987
          ],
          "area": 30773
        }
      ]
    },
    {
      "id": "p16",
      "source": "actions",
      "anchor_source": [
        1100,
        982
      ],
      "components": [
        {
          "bbox": [
            985,
            799,
            1216,
            982
          ],
          "area": 25787
        }
      ]
    },
    {
      "id": "p17",
      "source": "actions",
      "anchor_source": [
        161,
        1216
      ],
      "components": [
        {
          "bbox": [
            53,
            1024,
            295,
            1216
          ],
          "area": 26981
        }
      ]
    },
    {
      "id": "p18",
      "source": "actions",
      "anchor_source": [
        479,
        1208
      ],
      "components": [
        {
          "bbox": [
            362,
            1046,
            605,
            1208
          ],
          "area": 25414
        }
      ]
    },
    {
      "id": "p19",
      "source": "actions",
      "anchor_source": [
        790,
        1216
      ],
      "components": [
        {
          "bbox": [
            665,
            1044,
            926,
            1216
          ],
          "area": 26744
        }
      ]
    },
    {
      "id": "p20",
      "source": "actions",
      "anchor_source": [
        1100,
        1217
      ],
      "components": [
        {
          "bbox": [
            973,
            1031,
            1238,
            1217
          ],
          "area": 28356
        }
      ]
    }
  ],
  "clips": {
    "idle": {
      "poses": [
        "p01",
        "p02",
        "p03",
        "p04"
      ],
      "fps": 6,
      "windup_frame": 0,
      "contact_frame": 2
    },
    "move": {
      "poses": [
        "p05",
        "p06",
        "p07",
        "p08"
      ],
      "fps": 9,
      "windup_frame": 0,
      "contact_frame": 2
    },
    "attack": {
      "poses": [
        "p09",
        "p10",
        "p11",
        "p12"
      ],
      "fps": 8,
      "windup_frame": 1,
      "contact_frame": 2
    },
    "special": {
      "poses": [
        "p13",
        "p14",
        "p15",
        "p16"
      ],
      "fps": 8,
      "windup_frame": 1,
      "contact_frame": 2
    },
    "hit": {
      "poses": [
        "p17",
        "p18",
        "p19",
        "p20"
      ],
      "fps": 10,
      "windup_frame": 0,
      "contact_frame": 2
    }
  },
  "action_clips": {
    "slam": "attack",
    "slam@0": "attack",
    "slam@1": "special"
  }
}
